{
  "version": "unswell-tetra-import-v1",
  "repository": "https://github.com/chemicaltree/tetra",
  "revision": "0000000000000000000000000000000000000000",
  "license": "CC-BY-4.0",
  "include_xml": true,
  "files": [
    {
      "path": "original/P01-1001-A.xml",
      "sha256": "d970f7e5676a0b37c45bd2f5e190cd28cb6f9d017852aca3828f58cb98ce5c80",
      "git_blob": "e4a1b137509ca365f4f1626ce22d30f14fc01be9",
      "xml_base64": "PGRvYyBpZD0iUDAxLTEwMDEiIGVkaXRvcj0iQSI+CiAgPHRpdGxlPjx0ZXh0PlJldHJ5IGJlaGF2aW9yPC90ZXh0PjwvdGl0bGU+CiAgPGFic3RyYWN0PgogICAgPHRleHQ+Q2Fmw6kgY2xpZW50czwvdGV4dD4KICAgIDxlZGl0IHR5cGU9ImdyYW1tYXIiIGNycj0icmV0cnkiIGNvbW1lbnRzPSIiPnJldHJpZXM8L2VkaXQ+CiAgICA8ZWRpdCB0eXBlPSJyZWR1bmRhbmN5IiBjcnI9IiI+dmVyeTwvZWRpdD4KICAgIDx0ZXh0PmNhcmVmdWxseS48L3RleHQ+CiAgPC9hYnN0cmFjdD4KICA8aW50cm9kdWN0aW9uPjx0ZXh0PlJldHJ5IGF0IG1vc3QgdHdpY2UuPC90ZXh0PjwvaW50cm9kdWN0aW9uPgo8L2RvYz4K"
    }
  ]
}
